<?xml version="1.0" encoding="UTF-8" standalone="no"?>
<?xml-stylesheet href="xsd.xsl" type="text/xsl"?>
<!-- Copying and distribution of this file, with or without modification,
     are permitted in any medium without royalty provided the copyright
     notice and this notice are preserved.  This file is offered as-is,
     without any warranty.
-->
<xs:schema targetNamespace="http://www.harctoolbox.org/irp-protocols"
           xmlns="http://www.harctoolbox.org/irp-protocols"
           xmlns:xs="http://www.w3.org/2001/XMLSchema"
           xmlns:xml="http://www.w3.org/XML/1998/namespace"
           xmlns:html="http://www.w3.org/1999/xhtml"
           xmlns:xi="http://www.w3.org/2001/XInclude"
           elementFormDefault="qualified" attributeFormDefault="unqualified">
    <xs:annotation>
        <xs:documentation>
            <html:div>
                The Girr format
                is documented at <html:a href="http://www.harctoolbox.org/Girr.html">www.harctoolbox.org/Girr.html</html:a>
            </html:div>
        </xs:documentation>
    </xs:annotation>

    <xs:import namespace="http://www.w3.org/XML/1998/namespace" schemaLocation="http://www.w3.org/2001/xml.xsd"/>
    <xs:import namespace="http://www.w3.org/1999/xhtml" schemaLocation="http://www.w3.org/2002/08/xhtml/xhtml1-strict.xsd"/>
    <xs:import namespace="http://www.w3.org/2001/XInclude" schemaLocation="https://www.w3.org/2001/XInclude/XInclude.xsd"/>

    <xs:element name="protocols">
        <xs:complexType>
            <xs:annotation>
                <xs:documentation>The collection of protocols.
                </xs:documentation>
            </xs:annotation>
            <xs:sequence>
                <xs:element ref="adminData" minOccurs="0"/>
                <xs:choice maxOccurs="unbounded">
                    <xs:element ref="xi:include"/>
                    <xs:element ref="protocol"/>
                </xs:choice>
            </xs:sequence>
            <xs:attributeGroup ref="version"/>
        </xs:complexType>
    </xs:element>

    <xs:element name="protocol">
        <xs:complexType>
            <xs:annotation>
                <xs:documentation>One protocol in IRP form.</xs:documentation>
            </xs:annotation>
            <xs:sequence maxOccurs="unbounded">
                <xs:choice>
                    <xs:element ref="irp"/>
                    <xs:element ref="documentation"/>
                    <xs:element ref="parameter" minOccurs="0" maxOccurs="unbounded"/>
                </xs:choice>
            </xs:sequence>
            <xs:attributeGroup ref="name"/>
            <xs:attributeGroup ref="c-name"/>
            <xs:attributeGroup ref="usable"/>
        </xs:complexType>
    </xs:element>

    <xs:element name="irp">
        <xs:complexType mixed="true"/>
    </xs:element>

    <xs:element name="documentation">
        <xs:complexType mixed="true">
            <xs:annotation>
                <xs:documentation>Textual notes, possibly using formatting in HTML.</xs:documentation>
            </xs:annotation>
            <xs:sequence>
                <xs:any minOccurs="0" maxOccurs="unbounded" processContents="lax"/>
            </xs:sequence>
            <xs:attribute ref="xml:lang" default="en"/>
        </xs:complexType>
    </xs:element>

    <xs:element name="parameter">
        <xs:complexType mixed="true">
            <xs:attribute name="name" type="xs:string"/>
        </xs:complexType>
    </xs:element>

    <xs:attributeGroup name="version">
        <xs:attribute name="version" type="xs:string">
            <xs:annotation>
                <xs:documentation>Version of the document.</xs:documentation>
            </xs:annotation>
        </xs:attribute>
    </xs:attributeGroup>

    <xs:attributeGroup name="name">
        <xs:attribute name="name" type="xs:string">
            <xs:annotation>
                <xs:documentation>Name of the protocol.</xs:documentation>
            </xs:annotation>
        </xs:attribute>
    </xs:attributeGroup>

    <xs:attributeGroup name="c-name">
        <xs:attribute name="c-name" type="xs:string">
            <xs:annotation>
                <xs:documentation>Name of the protocol, as used in code.</xs:documentation>
            </xs:annotation>
        </xs:attribute>
    </xs:attributeGroup>

    <xs:attributeGroup name="usable">
        <xs:attribute name="usable" type="xs:boolean">
            <xs:annotation>
                <xs:documentation>Setting this to false disables the protocol.</xs:documentation>
            </xs:annotation>
        </xs:attribute>
    </xs:attributeGroup>

    <xs:element name="adminData">
        <xs:complexType>
            <xs:sequence>
                <xs:element ref="creationData" minOccurs="0"/>
                <xs:element ref="versioningData" minOccurs="0"/>
                <xs:element ref="notes" minOccurs="0" maxOccurs="unbounded"/>
            </xs:sequence>
        </xs:complexType>
        <xs:unique name="uniqueLanguagesInNotesAdminData">
            <xs:selector xpath="notes"/>
            <xs:field xpath="@xml:lang"/>
        </xs:unique>
    </xs:element>

    <xs:element name="creationData">
        <xs:annotation>
            <xs:documentation>Describes how, from what, and by whom the document was created.</xs:documentation>
        </xs:annotation>
        <xs:complexType>
            <xs:attribute name="creatingUser" type="xs:string" use="optional">
                <xs:annotation>
                    <xs:documentation>Name of creating user</xs:documentation>
                </xs:annotation>
            </xs:attribute>
            <xs:attribute name="source" type="xs:string" use="optional">
                <xs:annotation>
                    <xs:documentation>Source of the information, for example, another document that was converted to the present one.</xs:documentation>
                </xs:annotation>
            </xs:attribute>
            <xs:attribute name="creationDate" type="xs:string" use="optional">
                <xs:annotation>
                    <xs:documentation>Date of creation, or last modification.</xs:documentation>
                </xs:annotation>
            </xs:attribute>
            <xs:attribute name="tool" type="xs:string" use="optional">
                <xs:annotation>
                    <xs:documentation>Name of creating tool.</xs:documentation>
                </xs:annotation>
            </xs:attribute>
            <xs:attribute name="toolVersion" type="xs:string" use="optional">
                <xs:annotation>
                    <xs:documentation>Version of creating tool.</xs:documentation>
                </xs:annotation>
            </xs:attribute>
            <xs:attribute name="tool2" type="xs:string" use="optional">
                <xs:annotation>
                    <xs:documentation>Name of secondary creating tool, if applicable.</xs:documentation>
                </xs:annotation>
            </xs:attribute>
            <xs:attribute name="tool2Version" type="xs:string" use="optional">
            <xs:annotation>
                    <xs:documentation>Version of creating tool.</xs:documentation>
                </xs:annotation>
            </xs:attribute>
        </xs:complexType>
    </xs:element>

    <xs:element name="versioningData">
        <xs:annotation>
            <xs:documentation>Versioning data; semanics is still to be determined.</xs:documentation>
        </xs:annotation>
        <xs:complexType mixed="true">
            <xs:sequence minOccurs="0" maxOccurs="unbounded">
                <xs:any processContents="skip" minOccurs="0" maxOccurs="unbounded"/>
            </xs:sequence>
        </xs:complexType>
    </xs:element>

    <xs:element name="notes">
        <xs:annotation>
            <xs:documentation>Textual notes, possibly using formatting in HTML.</xs:documentation>
        </xs:annotation>
        <xs:complexType mixed="true">
            <xs:sequence>
                <xs:any minOccurs="0" maxOccurs="unbounded" processContents="lax"/>
            </xs:sequence>
            <xs:attribute ref="xml:lang" default="en"/>
        </xs:complexType>
    </xs:element>

</xs:schema>
