<?xml version="1.0" encoding="UTF-8"?>
<!-- Initiated by Lyndel McGee -->
<irp:protocols xmlns="http://www.w3.org/1999/xhtml"
               xmlns:rm="https://sourceforge.net/projects/controlremote/files/RemoteMaster"
               xmlns:xi="http://www.w3.org/2001/XInclude"
               xmlns:xsi="http://www.w3.org/2001/XMLSchema-instance"
               version="2024-10-29"
               xsi:schemaLocation="http://www.harctoolbox.org/irp-protocols http://www.harctoolbox.org/schemas/irp-protocols.xsd"
               xmlns:irp="http://www.harctoolbox.org/irp-protocols">

    <irp:protocol name="Apple_wiki">
        <irp:irp>
            <![CDATA[{38.4k,564}<1,-1|1,-3>(16,-8,P:5,Vendor:11,C:1,F:7,D:8,1,^108m,(16,-4,1,^108m)*){Vendor=0x43f,C=1-(#P+#Vendor+#F+#D)%2}[P:0..31,F:0..127,D:0..255]]]>
        </irp:irp>
        <irp:documentation xml:space="preserve">This version of the  Apple protocol follows <a href="https://en.wikipedia.org/wiki/Apple_Remote">this wiki page</a>.</irp:documentation>
        <!--irp:parameter name="uei-executor">01E0{S=135,E=PairID}[D?0,E|||D?1,S,D?2,D?3;F,??,0]</irp:parameter-->
        <irp:parameter name="prefer-over">Apple</irp:parameter>
        <irp:parameter name="prefer-over">NEC1-f16</irp:parameter>
        <irp:parameter name="prefer-over">NEC2-f16</irp:parameter>
        <irp:parameter name="prefer-over">NEC1</irp:parameter>
        <irp:parameter name="prefer-over">NEC-Shirriff-32</irp:parameter>
    </irp:protocol>

</irp:protocols>
