<?xml version="1.0" encoding="UTF-8" standalone="no"?>
<?xml-stylesheet type="text/xsl" href="IrpProtocols2html.xsl"?>
<irp:protocols xmlns="http://www.w3.org/1999/xhtml"
               xmlns:xi="http://www.w3.org/2001/XInclude"
               xmlns:xsi="http://www.w3.org/2001/XMLSchema-instance"
               version="covfefe"
               xsi:schemaLocation="http://www.harctoolbox.org/irp-protocols http://www.harctoolbox.org/schemas/irp-protocols.xsd"
               xmlns:irp="http://www.harctoolbox.org/irp-protocols">

    <!-- No xi:fallback element: fatal error if xinclude fails -->
    <xi:include href="extra-protocol.xml" xpointer="element(/1/2)"/>

    <!-- Test of the fallback mechanism -->
    <xi:include href="no-such-file">
        <xi:fallback>
            <irp:protocol name="covid-19">
                <irp:irp>
            <![CDATA[{38.4k,564}<1,-1|1,-3>(16,-8,D:8,S:8,F:8,~F:8,1,^108m,(16,-4,1,^108m)*)[D:0..255,S:0..255=255-D,F:0..255]]]>
                </irp:irp>
                <irp:documentation>Lorem Ipsum</irp:documentation>
            </irp:protocol>
        </xi:fallback>
    </xi:include>

    <!-- remove this protocol -->
    <irp:protocol name="neC2"/>

    <!-- modify the NEC1 protocol -->
    <irp:protocol name="NEC1">

        <!-- add this -->
        <irp:parameter name="foo">bar</irp:parameter>
        <irp:parameter name="alt_name">NECrophile</irp:parameter>

        <!-- overwrite this -->
        <irp:documentation>Nec1 new doc</irp:documentation>

        <!-- add this -->
        <irp:parameter name="prefer-over">foobar</irp:parameter>

        <!-- Should NOT be added, since already there -->
        <irp:parameter name="prefer-over">Pioneer</irp:parameter>

    </irp:protocol>   <!-- modify the NEC1 protocol -->

    <irp:protocol name="NEC1-f16">

        <!-- add this -->
        <irp:documentation>Lorem Ipsum</irp:documentation>
    </irp:protocol>

    <!-- add this protocol -->
    <irp:protocol name="foobar">
        <irp:irp>
            <![CDATA[{38.4k,564}<1,-1|1,-3>(16,-8,D:8,S:8,F:8,~F:8,1,^108m,(16,-4,1,^108m)*)[D:0..255,S:0..255=255-D,F:0..255]]]>
        </irp:irp>
        <irp:documentation>Lorem Ipsum</irp:documentation>
    </irp:protocol>

    <!-- Remove all text properties with a certain name from a protocol -->
    <irp:protocol name="nec1">
        <irp:parameter name="uei-executor"/>
    </irp:protocol>

    <!-- Remove all xml properties with a certain name from a protocol -->
    <irp:protocol name="amino">
        <irp:parameter name="uei-executor" type="xml"/>
    </irp:protocol>

    <!-- nuke documentation -->
    <irp:protocol name="amino">
        <irp:documentation/>
    </irp:protocol>

    <!-- test that usable="false" works -->
    <irp:protocol name="covfefe" usable="false">
        <irp:irp>
            <![CDATA[{38.4k,564}<1,-1|1,-3>(16,-8,D:8,S:8,F:8,~F:8,1,^108m,(16,-4,1,^108m)*)[D:0..255,S:0..255=255-D,F:0..255]]]>
        </irp:irp>
        <irp:documentation>Lorem Ipsum</irp:documentation>
    </irp:protocol>

    <!-- Testing that both removal and addition of parameter values work together -->
    <irp:protocol name="Aiwa">
        <irp:parameter name="uei-executor">xxxxx</irp:parameter>
        <irp:parameter name="uei-executor"/> <!-- nukes everything up until now -->
        <irp:parameter name="uei-executor">9999[S;D,F]</irp:parameter>
    </irp:protocol>

</irp:protocols>
